{
  "schema_version": 1,
  "recast_id": "demo-a-uses-zhou",
  "base_pack": "assets/resourcepacks/characters-v12-1.21.1.zip",
  "replacements": {
    "a": {
      "pack": "assets/resourcepacks/characters-v12-1.21.1.zip",
      "source_role": "zhou"
    }
  },
  "output_pack": "assets/resourcepacks/recasts/demo-a-uses-zhou.zip"
}
